{
  "schema_version": 1,
  "app_version": "0.1.0",
  "owner_tag": "k3m9p2q7r4t8v5w1",
  "entries": [
    {
      "id": "codex-hooks",
      "tool": "codex",
      "target": "codex_hooks",
      "path": "/Users/alex/.codex/hooks.json",
      "action": "create_file",
      "state": "installed",
      "installed_at": 1791806400000,
      "before": {
        "existed": false,
        "sha256": null,
        "bytes": null
      },
      "after": {
        "sha256": "b7e211cae4473eaf27cc378f828e967345cd8829eb8470f47e53a18101a959af",
        "bytes": 640
      },
      "owned": [
        {
          "event": "SessionStart",
          "pointer": "/hooks/SessionStart/0",
          "sha256": "a8549d0e5c1ac3ffb912de37d3b77bdce6ef79e8aeceb2ae48bd194c2bfe58db",
          "replaced_sha256": null
        }
      ]
    }
  ]
}
